{
  "schema_version": "1.0",
  "task_id": "demo-review-001",
  "source_kind": "router-manifest",
  "source_schema_version": "1.0",
  "status": "approval_required",
  "summary": [
    "source: Router manifest",
    "status: approval_required",
    "candidate: local-review",
    "authority: none",
    "execution: none",
    "local snapshot"
  ],
  "authority_effect": false,
  "execution_effect": false
}
